{
  "observer_contract": 2,
  "observer_message_id": "11111111-1111-4111-8111-111111111111",
  "payload_digest": "aaaaaaaaaaaaaaaaaaaaaaaaaaaaaaaaaaaaaaaaaaaaaaaaaaaaaaaaaaaaaaaa",
  "connector_sequence": 10,
  "observer_message_type": "session.event.v2",
  "profile": "default",
  "session_key": "session-root-1",
  "runtime_generation": "runtime-20260801-01",
  "runtime_session_id": "runtime-session-1",
  "event_sequence": 4,
  "committed_at": "2026-08-01T00:00:02Z"
}
